{
  "completed_tasks": [
    "Compressed the songs page header to a single title and compact aggregate count.",
    "Removed redundant header kicker, large marketing-style headline, explanatory paragraph, and separate stats block.",
    "Reduced each song row to title, artist, feel, section count, and system count.",
    "Preserved Link-based row accessibility, focus-visible styling, and the existing empty state."
  ],
  "changed_files": [
    "src/app/songs/page.tsx",
    "src/app/songs/song-list.tsx",
    "docs/ideas/remove-songs-ui-weeds.md",
    ".ai/runs/2026-07-11T02-41-49.326Z_remove-songs-ui-weeds/plan.json",
    ".ai/runs/2026-07-11T02-41-49.326Z_remove-songs-ui-weeds/design.json",
    ".ai/runs/2026-07-11T02-41-49.326Z_remove-songs-ui-weeds/build.json",
    ".ai/runs/2026-07-11T02-41-49.326Z_remove-songs-ui-weeds/run.json"
  ],
  "notes": [
    "No new components, dependencies, CSS files, or semantic CSS classes were added.",
    "The previous data cleanup remains in place: janhyang-photo-sample is still absent from src/lib/songs.ts.",
    "React best-practices review was applied: server components remain simple, links stay semantic, and list keys use stable song IDs."
  ],
  "open_issues": []
}
