{
  "completed_tasks": [
    "Removed the complete src/app/quiz App Router segment and its route-local IntervalQuiz component.",
    "Removed the complete src/app/chords App Router segment and its route-local Chord and PlayButton components.",
    "Removed only the Chords and Quiz entries from the shared primary navigation.",
    "Preserved remaining navigation order, active-state behavior, unrelated pages, shared music utilities, historical documentation, and prior run artifacts."
  ],
  "changed_files": [
    "src/app/app-nav.tsx",
    "src/app/quiz/page.tsx (deleted)",
    "src/app/quiz/interval-quiz.tsx (deleted)",
    "src/app/chords/page.tsx (deleted)",
    "src/app/chords/chord.tsx (deleted)",
    "src/app/chords/play-button.tsx (deleted)",
    "docs/ideas/remove-quiz-chords-pages.md",
    ".ai/runs/2026-07-23T16-47-54.798Z_remove-quiz-chords-pages/run.json",
    ".ai/runs/2026-07-23T16-47-54.798Z_remove-quiz-chords-pages/memory.json",
    ".ai/runs/2026-07-23T16-47-54.798Z_remove-quiz-chords-pages/plan.json",
    ".ai/runs/2026-07-23T16-47-54.798Z_remove-quiz-chords-pages/design.json",
    ".ai/runs/2026-07-23T16-47-54.798Z_remove-quiz-chords-pages/build.json"
  ],
  "notes": [
    "The implementation follows the vercel:nextjs App Router convention: removing a segment's page.tsx removes the public route.",
    "No redirects, replacement pages, dependencies, CSS rules, semantic classes, or styling changes were added.",
    "React best-practices review found no new component, hook, accessibility, performance, or TypeScript risk; the sole surviving TSX edit removes two static navigation entries."
  ],
  "open_issues": []
}
